{
  "account_service_log_out_url": "http://localhost:8000/logout",
  "account_service_url": "http://localhost:8000",
  "case_id": "f48e8790-f591-4086-9f6d-98c8642d96cb",
  "channel": "rh",
  "collection_exercise_sid": "77d00da0-9245-40a3-9219-a9f860066167",
  "eq_id": "census",
  "exp": 1781701146,
  "iat": 1781693946,
  "jti": "1c6eff87-cc03-425b-9bd4-f4c81596cd86",
  "language_code": "en",
  "region_code": "GB-ENG",
  "response_expires_at": "2027-06-22T13:23:39+00:00",
  "response_id": "1929",
  "schema_name": "census_household_gb_eng",
  "survey": "CENSUS",
  "survey_metadata": {
    "data": {
      "case_type": "HH",
      "display_address": "15 Credibility Street, Bristol, BS7 8ES",
      "form_type": "H",
      "period_id": "2027",
      "ru_ref": "uprn:00001",
      "user_id": "UNKNOWN"
    },
    "receipting_keys": ["questionnaire_id"]
  },
  "tx_id": "7e916adc-1f36-4f1e-81f9-57a4ab4ad183",
  "version": "v2"
}
